{"artifacts":[],"attempt_id":"REPLACE_WITH_ATTEMPT_ID","blocker":null,"checkpoint_id":"REPLACE_WITH_CHECKPOINT_ID","completed_phases":[],"completed_units":[],"configuration_fingerprint":"0000000000000000000000000000000000000000000000000000000000000000","effects":[],"operation_id":"REPLACE_WITH_OPERATION_ID","phase":"preflight","pinned_release":{"source_commit":"0000000000000000000000000000000000000000","version":"REPLACE_WITH_RELEASE_VERSION"},"predecessor":null,"remaining_work":{"phase":"preflight"},"schema_version":1,"scope":{},"sequence":0,"verification":{}}
